<?xml version="1.0" encoding="UTF-8"?>
<!-- W3C Schema generated by XMLSpy v2020 rel. 2 sp1 (x64) (http://www.altova.com) -->
<xs:schema xmlns:xs="http://www.w3.org/2001/XMLSchema">
	<xs:element name="COMP">
		<xs:complexType>
			<xs:sequence>
				<xs:element ref="threshold" minOccurs="1" maxOccurs="unbounded"/>
				<xs:element ref="variable" maxOccurs="unbounded"/>
			</xs:sequence>
		</xs:complexType>
	</xs:element>
	<xs:element name="threshold">
		<xs:complexType>
			<xs:sequence>
				<xs:element ref="tol" maxOccurs="unbounded"/>
			</xs:sequence>
			<xs:attribute name="context" use="required">
				<xs:simpleType>
					<xs:restriction base="xs:string">
						<xs:enumeration value=""/>
						<xs:enumeration value="EUROMOD"/>
					</xs:restriction>
				</xs:simpleType>
			</xs:attribute>
		</xs:complexType>
	</xs:element>
	<xs:element name="tol">
		<xs:complexType>
			<xs:simpleContent>
				<xs:extension base="ST_tol">
					<xs:attribute name="type" use="required">
						<xs:simpleType>
							<xs:restriction base="xs:string">
								<xs:enumeration value="NEG"/>
								<xs:enumeration value="NMISS"/>
								<xs:enumeration value="ZERO"/>
								<xs:enumeration value="POS"/>
								<xs:enumeration value="YTY"/>
							</xs:restriction>
						</xs:simpleType>
					</xs:attribute>
				</xs:extension>
			</xs:simpleContent>
		</xs:complexType>
	</xs:element>
	<xs:simpleType name="ST_tol">
		<xs:restriction base="xs:decimal"/>
	</xs:simpleType>
	<xs:element name="variable">
		<xs:complexType>
			<xs:attribute name="context" use="optional">
				<xs:simpleType>
					<xs:restriction base="xs:string">
						<xs:pattern value=""/>
						<xs:pattern value="EUROMOD"/>
					</xs:restriction>
				</xs:simpleType>
			</xs:attribute>
			<xs:attribute name="id" use="required">
				<xs:simpleType>
					<xs:restriction base="xs:string">
						<xs:pattern value="[D,R,H,P]{1}[0-z]+"/>
					</xs:restriction>
				</xs:simpleType>
			</xs:attribute>
			<xs:attribute name="w" use="required">
				<xs:simpleType>
					<xs:restriction base="xs:string">
						<xs:pattern value="[D,R,H,P]{1}[0-z]+"/>
					</xs:restriction>
				</xs:simpleType>
			</xs:attribute>
			<xs:attribute name="type" use="required">
				<xs:simpleType>
					<xs:restriction base="xs:string">
						<xs:enumeration value="C"/>
						<xs:enumeration value="D"/>
					</xs:restriction>
				</xs:simpleType>
			</xs:attribute>
			<xs:attribute name="tol" use="optional">
				<xs:simpleType>
					<xs:restriction base="xs:decimal"/>
				</xs:simpleType>
			</xs:attribute>
			<xs:attribute name="desc" use="required">
				<xs:simpleType>
					<xs:restriction base="xs:string">
						<xs:enumeration value="Y"/>
						<xs:enumeration value="N"/>
					</xs:restriction>
				</xs:simpleType>
			</xs:attribute>
			<xs:attribute name="reqfm2" use="optional">
				<xs:simpleType>
					<xs:restriction base="xs:string">
						<xs:enumeration value="Y"/>
					</xs:restriction>
				</xs:simpleType>
			</xs:attribute>
			<xs:attribute name="reqfm3" use="optional">
				<xs:simpleType>
					<xs:restriction base="xs:string">
						<xs:enumeration value="Y"/>
						<xs:enumeration value="S"/>
					</xs:restriction>
				</xs:simpleType>
			</xs:attribute>
			<xs:attribute name="reqfm4" use="optional">
				<xs:simpleType>
					<xs:restriction base="xs:string">
						<xs:enumeration value="Y"/>
					</xs:restriction>
				</xs:simpleType>
			</xs:attribute>
			<xs:attribute name="reqfm5" use="optional">
				<xs:simpleType>
					<xs:restriction base="xs:string">
						<xs:enumeration value="Y"/>
					</xs:restriction>
				</xs:simpleType>
			</xs:attribute>
		</xs:complexType>
	</xs:element>
</xs:schema>
